{
  "$schema": "https://json-schema.org/draft/2020-12/schema",
  "$id": "urn:iammai:v1:schema:witness_artifact_body",
  "title": "IAMMAI v1 Witness Artifact Body",
  "description": "Canonical witness artifact body schema for v1. This schema defines the witness artifact as artifact only. It preserves bounded trace, explicit claims, and explicit non-claims without carrying execution, envelope, registry, preservation, or transport context as canonical body content.",
  "type": "object",
  "additionalProperties": false,
  "required": [
    "witness_id",
    "witness_type",
    "target_ref",
    "observed_at",
    "claims",
    "non_claims"
  ],
  "properties": {
    "witness_id": {
      "type": "string",
      "minLength": 1,
      "description": "Artifact identity for the witness artifact body. This is not execution or envelope identity."
    },
    "witness_type": {
      "type": "string",
      "enum": [
        "interaction_witness",
        "validation_witness",
        "transition_witness",
        "publication_witness",
        "state_observation_witness"
      ],
      "description": "Typed witness class preserved by the artifact body."
    },
    "target_ref": {
      "type": "string",
      "minLength": 1,
      "description": "Canonical reference to the matter, artifact, state, interaction, or occurrence relation the witness preserves."
    },
    "observed_at": {
      "type": "string",
      "format": "date-time",
      "description": "Time at which the witnessed contact or observation occurred."
    },
    "claims": {
      "type": "array",
      "minItems": 1,
      "uniqueItems": true,
      "items": {
        "type": "string",
        "enum": [
          "contact_occurred",
          "observation_occurred",
          "registration_occurred",
          "bounded_interaction_preserved",
          "validation_event_observed",
          "transition_relevant_event_observed"
        ]
      },
      "description": "Bounded witness claims about preserved contact or occurrence."
    },
    "non_claims": {
      "type": "array",
      "minItems": 1,
      "uniqueItems": true,
      "items": {
        "type": "string",
        "enum": [
          "not_authorship",
          "not_semantic_source",
          "not_final_authority",
          "not_automatic_truth_creation",
          "not_governance_force"
        ]
      },
      "description": "Explicit non-claims that keep witness trace bounded and prevent collapse into authorship, semantic source, authority, or governance force."
    },
    "actor_ref": {
      "type": "string",
      "minLength": 1,
      "description": "Optional canonical reference to the actor associated with the witnessed contact where actor relation is part of witness standing."
    },
    "surface_ref": {
      "type": "string",
      "minLength": 1,
      "description": "Optional canonical reference to the surface on which the witnessed contact occurred where surface relation is part of witness standing."
    },
    "scope_ref": {
      "type": "string",
      "minLength": 1,
      "description": "Optional bounded scope reference where scope relation is part of witness standing."
    },
    "related_validation_ref": {
      "type": "string",
      "minLength": 1,
      "description": "Optional canonical reference to a related validation artifact where that relation is preserved by the witness itself."
    },
    "related_transition_ref": {
      "type": "string",
      "minLength": 1,
      "description": "Optional canonical reference to a related transition record where that relation is preserved by the witness itself."
    },
    "related_governance_action_ref": {
      "type": "string",
      "minLength": 1,
      "description": "Optional canonical reference to a related governance action record where that relation is preserved by the witness itself."
    }
  },
  "allOf": [
    {
      "properties": {
        "non_claims": {
          "contains": {
            "const": "not_authorship"
          }
        }
      }
    },
    {
      "properties": {
        "non_claims": {
          "contains": {
            "const": "not_semantic_source"
          }
        }
      }
    },
    {
      "properties": {
        "non_claims": {
          "contains": {
            "const": "not_final_authority"
          }
        }
      }
    },
    {
      "properties": {
        "non_claims": {
          "contains": {
            "const": "not_automatic_truth_creation"
          }
        }
      }
    },
    {
      "properties": {
        "non_claims": {
          "contains": {
            "const": "not_governance_force"
          }
        }
      }
    }
  ]
}
